{
  "schema_version": "0.1",
  "claim_id": "claim-004",
  "claim": {
    "type": "observation",
    "statement": "A value was recorded, but its origin and processing state are not established."
  },
  "data_origin": "unknown",
  "data_processing": "unknown",
  "spatial_scope": { "type": "named_area", "name": "Example Area" },
  "temporal_scope": { "observed_at": "2026-03-10T12:00:00Z" },
  "evidence": [],
  "display": { "label": "Unattributed example value" },
  "processing": { "method": "Example unrecorded procedure" }
}
