{
  "schema_version": "0.1",
  "claim_id": "claim-301",
  "claim": {
    "type": "observation",
    "statement": "A vegetation index was computed for the specified area.",
    "value": 0.42,
    "unit": "1"
  },
  "data_origin": "measured",
  "data_processing": "derived",
  "spatial_scope": { "type": "named_area", "name": "Example Area" },
  "temporal_scope": { "observed_at": "2026-01-15T01:30:00Z" },
  "evidence": [
    {
      "id": "evidence-301",
      "type": "dataset",
      "title": "Example synthetic source record",
      "uri": "urn:example:evidence:301"
    }
  ],
  "display": { "label": "Vegetation index for the area", "display_unit": "1" },
  "processing": { "method": "Example index calculation" }
}
